Review,Score
"I go into every movie hoping to get through to the end feeling satisfied. I most certainly was with The Electric State. 
Cast played their roles well, cgi was great and the story was solid enough to keep myself and the kids engaged. We were able to follow what and why things were happening, while having laugh out loud moments and heart felt sad spots. 
The critics that give this a terrible rating are out of touch with what movies are supposed to be. ",4
"Worth the 2 hour watch! Admittedly the script doesn't favour Millie or Chris well, but it works. Great entertainment that all the family will enjoy. ",4
"Renewed my Netflix subscription just to watch this movie. I love this kind of movies, don't care what critics say",5
Really enjoyed the imagination of the story. Great film for the family. Honestly don't understand the low ratings by the critics.,4
"Critics got this wrong. Badly.

Whilst the budget isn't really obvious in the film it does what it set out to do. It's fun, all be it long. 

Might have worked better as a series to be fair, but it's not a fizzler like the overhyped critics will let you believe 🤷",4.5
"O filme é divertido, achei os personagens tinham uma boa química e a história me pegou. Gostei do filme.",4
"honestly, the story is kind of rushed, and the pacing is wayyy off. some scenes are rushed and others are dragged on. however, that being said, i haven’t seen special effects and cgi THAT good since pacific rim. well worth the watch if you respect and love well made cgi. honestly they spent all that money solely on social effects and NOT paying the writers.",3.5
"Some critics bashed this movie.    I will say, turn it on and just enjoy the Characters and the movie.    I absolutely loved it and kept me riveted to the screen till the end.    Some critics are trying to compare it with other movies.   You will either love it or hate.  I loved it!!!!!",5
The movie was solid but admittedly there was something lacking that really didn’t hit home with the emotionally elements that it seemed was its intent. Overall though I’ve seen a lot worse and honestly worth the watch if you see yourself drawn to it,3.5
"I read a review somewhere saying this was the worst movie ever made ..they were right. The film reminded me of a really bad 1980s era Spielberg film...Not only is it a horribly bad film, why is Millie Bobby Brown always, always, always wearing heavy makeup and lipstick? Again, avoid this film at all costs....but wait, maybe, just maybe this is the replacement for the Rocky Horror Picture Show? Will we get stoned off our asses, go to watch Electric State and thrown toy robots and toilet paper at the screen? Will people get up and dance on stage? Yeah, this could be a great thing....!",1
Fun movie with a great cast,5
"Ignore the critics, this was a great movie! Yes easy to guess the plot buuuut a funny, nostalgic, political, clever, heart breaking and visually  engaging movie it was for sure! I’ve never written a review before but just wanna put my pennies worth in because these guys should get some credit, great movie who clearly know their target audience and was great to watch at home over the weekend. But agree with other reviews, would have been even more amazing in cinema and think some areas of the plot could have been explored deeper as it would have made it even more of a complex and interesting watch. Buuut such a clever and fun film with references to classic movies and characters! 😊",4
I absolutely loved this. Great humor. Great story. Great acting. I highly recommend this as a fun family film. My two teenage boys loved it too. ,5
"I really enjoyed this movie, is a cool mix of stunning visuals and emotional moments. It follows a touching story about family and survival in a futuristic world. Definitely worth watching if you're into sci-fi with heart.

",5
"Millie really is not her best. She seems mechanical like the robots. This is a terrible script for Chris Pratt, very bland. But overall, it’s worth a
 Watch just for the special effects if nothing else. I seriously doubt that we will see a part 2. If you start it with the proper expectation, you will likely enjoy it. It has such a seasoned actors, it could have been better. Still, check it out and don’t listen to the critics that seem more out of touch than ever before.",3
Fun movie for all the family! enjoyed it a lot more than I expected ,5
"Pretty good, nice acting, good for a movie night. ",3.5
"Easy the biggest self own by the critics all prejudging this film based only on its budget. 
Great fun film. Good heart. Kinda exactly the type of film my family has been hoping for these days. 
",5
I don’t know why people don’t like this movie I think it was very good,4
"Was it ground taking? No. 
Was it thought provoking? No.
Was it a fun watch on the weekend with nothing else to do but laze around? Absolutely!
From actor spotting and looking at each other going ""oh hey! It's that one actor...."" to all the 80/90's references and cool robots - it was just fun, bubblegum for the brain. 

",4
Great movie the whole family can watch together. Ignore the critics and judge it for yourself. We’ve given many a movie a go based on wonderful critic reviews that we enjoyed far less than this one. Have realistic expectations people. ,5
"I thought it was different  and a pleasant watch.
Quite a touching story line.
 
Tom Selleck was in a film called runaway where the machines started to attack humans i think that's the oldest film I've seen apart from the android in Alien.. but with all the AI fears out there it's still interesting to see films like this. 

Shame it's been slated so much. ",3.5
What I’ve learned never trust a clown of its opinion of a movie.  It may come as shocking but not everyone wants to watch same gender love stories.  Being born in the 70’s and growing up in the 90’s I will say this seems very period correct. In a way it’s a reversed roll of the movie cherry 2000.  This is actually better then borderlands which has too much appeal to the peanuts instead of the main population.  In fact I’ve watched it twice in the same week which I never do.  ,5
"Dont understand the hate for this movie. I enjoyed it a lot and it had a great message also
",4
I enjoyed it. Great movie to watch with older kids (9 years+). Pretty well done robotic graphics too.,4
"Don’t get the critic hate - enjoyable, visually stunning popcorn flick.",5
"So Electric State has 15% from critics and 80% from viewers. Meanwhile Emelia Perez is the other way round. Which movie would you rather spend a couple of hours of your time watching? It is a good movie, plenty of action and interesting ideas that weren't really explored. The SFX are incredible and worth watching for that alone. My only gripe is it would have been better as an 8 episode season on Netflix as they could have explored the different robots' backgrounds in flashback.",4.5
"Just when I thought Hollywood had forgotten how to make an original, funny, and visually stunning sci-fi movie, The Electric State comes along and proves me wrong. The Russo brothers, best known for delivering Avengers: Endgame, the last truly great Marvel movie, have done it again—this time crafting a heartfelt, imaginative adventure that resonated with my entire family.

The film’s ability to make you care deeply about a tiny robot, despite its limited screen time, is something I haven’t seen in years. That level of emotional storytelling, combined with breathtaking special effects and a unique vision, makes The Electric State a standout.

In a world flooded with forgettable content, this is the kind of movie that reminds me why I keep my Netflix subscription active while ignoring the rest. If Hollywood made more films like this, the industry wouldn’t feel so lost.",4.5
"I don’t get the criticism. This has real heart - the cgi robots have characters as believable as anything in the original Star Wars, and my 11-year old daughter loved it. Proper family fun. ",5
Terrible. Awful movie ,1
"Well now here we go!  It's easy to tell when critics fail to see the fact that a popcorn movie is just that.  This one is beautiful, imaginative, engaging and worth every minute because first and foremost it is entertaining.  I think this one is probably the most watchable original movie I've seen on Netflix.  I feel sorry for anyone too wrapped up in their own in their own little ball to find facination in this Masterpiece!",5
This movie was so fun! I truly loved it. My kids loved it too. I genuinely don’t understand the critics. ,5
"An amazing movie, a great movie for kids with a heartwarming story.",5
"I really enjoyed how the story was set up. I viewed it as, ""What if the Robot Uprising in ""The Matrix"" happened in the early 1990's, and the robots lost?"" Seeing how Titmouse did the 2D animation scenes for the ""old Cosmo Show"" was great. I also really enjoyed the banter between Chris Pratt's and Anthony Mackie's characters.",5
"Great visuals and fx but so too are found in Transformers movies.  Story or lack of may be worst here than Transformers.  The robots here lack character development and creativity.  AI the movie has better robots.  The Planters robot is annoying, fugly, and pure product placement.  The Stanley Tucci character delivers the best line that sums up this movie, ""Who cares?""",1
"I’ve seen films that deserve a 15%, this was not one of them.

I never write reviews, but I felt compelled after seeing the critical response to this movie. No, The Electric State does not offer us a unique story nor will it be heavy hitter in award season; however, they made a decent film.

There was enough backstory to care about the characters, well-timed comedic relief, and impressive visual effects. Overall, it was enjoyable and engaging. At what point do we fire the critics?",4
"I have watched this movie two times already. It's not endgame or infinity war, but it is a good movie, and it has heart. ",5
Enjoyable but poor casting choose. Mille is not the right actor for this film (not at 20/21… maybe at 13 could have been more plausible,2.5
Loved it. Lovely movie for kids. ,5
"The Electric State - 4/10. Soulless. That’s the word for this film. What’s sad about this megabudget film (rumoured to cost upwards of 300 million dollars), is that it just feels like a lot of ideas and thoughts thrown towards a board, and just hoping they would stick well with each other. The Electric State a movie that seems adamant on its visuals to wow you. Yes, its kinda fun and cool to see the nostalgia of the 80’s and 90’s pop culture things showered all over this. Seeing Mr. Peanut as one of the main characters is kinda interesting I guess? But just because you jam pack the movie with familiar things and with wall to wall special effects doesn’t mean you have a good movie in hand. Millie Bobby Brown has nothing really to work with here, and I felt like her performance is hampered due to the writing. For a big budget film, they could have easily given Chris Pratt a better wig. He just seems to be here, but again, none of the material is helping his respective performance. You got stars galore here in voice roles, but again, it doesn’t matter when the performances just feel dull due to the writing. I really can’t for the life of me think of a moment in this movie where I genuinely felt entertained. It just felt like I was waiting or anticipating it to pick up. It felt like the Russo’s threw a bunch of robot based movie plots into a blender and conjured up the story here. Instead of making a smoothie, it turned out to be a sloppy mixture. The Russo’s have a sense of flair with their visuals. I love their work on Community, and their respective work in Marvel is good. But I feel like they have coasted on great visuals and spectacle for quite some time. Not one joke or gag made me laugh whole heartedly or made me chuckle. Not one scene felt amazing to the point where I couldn’t wait for what’s gonna happen next. The Russo brothers should really start looking into working with better writers. Regardless of how their return to the MCU goes, this and their work in between their MCU stints have shown that they really need to hone their original ideas more thoroughly. Its a sad waste of money here, and this is one of those movies that would have easily been a more entertaining short film, or, possibly, a miniseries (though, I don’t think more of this would be better). Its not a terrible film, but its also one that just feel uninspired and tired and dull.",2
"My initial thoughts were ""It's not the worst movie you could spend 2 hours with, especially if you're looking for something inoffensive and family-friendly. 2 stars"" It's got a neat premise, a stellar cast and incredible CGI. It is also a wildly different story than its excellent source material - which I think really let down a lot of the critics who gave it such lousy reviews. 

As I've thought about it some more, I've become increasingly annoyed about how much it squanders its neat premise with some incredibly silly plot holes and lazy, poorly explained story beats. 
(It's never explained how the robots became sentient; the ""post robot-war new order"" relied on one particular human staying alive and imprisoned indefinitely, with no redundancy or failsafe - despite the fact that eventually ALL humans die; Chris Pratt just straight up plays ""Starlord,"" down to the cadence and accent; now that robots are ""free,"" do they become citizens? What kinds of rights do they get? Can't we still make autonomous robots that don't utilize whatever technology was advanced enough to allow robots to develop sentience? If not, why not? Now that the humans are somehow incapable of utilizing the billions of dollars worth of formerly remote-controlled robo-drones, what keeps a violent, rebellious sect of robots from violently revolting again if they don't feel like thy're being treated fairly enough? The ""positive"" note it ends on doesn't really resolve human-robot relations in any meaningful way.) If you're too young and/or uncritical to care about these things, enjoy the gorgeous CGI and the megastar cast. 


",0.5
It's not quite Love and Monsters. It's a bit Ready Player One. The scripts nothing new. Chris Pratt is fun enough. MBB is a bit intense as usual. Critics have been harsh. It's good enough for a streaming movie.,3
"Wow, I am shocked to discover so much hate for this film. We knew nothing about it prior to it's release and really enjoyed it. 
The animation and effects were good, the acting was pretty good. It was a bit formulaic but no worse than any other modern movie. 
We would probably watch it again if it was on TV.
Yeah, genuinely surprised at the response",4.5
"This movie was awesome. I don't know what the critics were thinking in giving this movie a bad time. Maybe the company didn't payed them to talk good about it, like they do with some movies. Granted the violence in action scenes were toned down for PG purposes and made less espectacular because of it, i never felt disappointed, because it fit the movie.

I loved the robot designs. For the most part, they looked like vintage toys, which gave the movie a really cool aesthetic.

Everyone did a great job acting, but the best character was definitely Anthony Mackie's Herman. I  hope they do a sequel or even a prequel, with him and Chris Pratt. Their chemistry was awesome and the character stole every scene he was in.

And the final moments of the movie just made it all better and brought a ton of heart to a charming movie to begin with. 

I would love to see a sequel. I think if they polish a few things, they could have something especial here.

",4
"Yeah, Wolverines! This movie was the kind of spectacle I didn't think Id find in March. ",5
"I went into this with very low expectations due to the online backlash against this film. Gotta say it's a decent family film. The plot is signposted a mile away, you know the villain/plot twist/ending way before they happen but who cares go and give it a watch, much worse put there for sure.",3.5
"Entertaining as hell, loved the story! The robots are amazing, and the CGI looks astonishing ",5
I sat through this movie hopping it would get better and it never did,1
Very good movie. Enjoy the story and the visuals.,5
"Hermosa película, mezcla comedia y drama perfectamente, el reparto es fenomenal y es bastante digerible, un mensaje profundo y positivo, yo le doy un 100! ",5
"It's a nice movie like one of those corny 80s adventure movies. Not every movie is meant to ""change your life"". Sometimes, we just want to have some fun and this flick fits in just fine.",4
"Although the script is not necessarily as though provoking as may have been intended, I found this to be a fun family watch.  There is violence but it is robot violence, minimal to zero blood.  The kids seemed to enjoy this movie a lot.",4
"A visual masterpiece dragged down by its script. There’s no heart and soul to this story, I spent more time admiring the CGI than caring about the characters. ",2.5
"Wow, what is everyone complaining about? This is a sick world if we've become so desensitized that we trash an""AWESOME"" Netflix production over our personal politics! My kids loved it and that's all that matters...",4.5
"SPOILERS! If you loved the movie just skip my review please.

Good - I fell in love with Herm the robot.

Bad - Oh boy.... Although I enjoy all the actors in the movie (and honestly the cast is great) the move just doesn't make any sense. The plot holes are pretty big and I am usually OK with that if the movie is fun but it's just kinda predictable.

Details - The tele-presence system supposedly relies on this ONE kids brain to function. Yep, one single comatose kids brain runs billions of remote controlled robots and his mind must be present to work the system. And if he dies the whole thing shuts down instantly.So all these military systems, airplanes, nuclear power plants, etc.. just immediately lose their pilots, controllers and operators. Cars would crash, refineries would explode, planes would crash, military bases would shutdown. It's not realistic.

And there is a no man's land of robots that if a human breaks into the area, the robots are in violation of a treaty and are in big big trouble. Nobody in the robot world is to blame but they are the one's in trouble and subject to execution.

And the robots all look goofy, cute, fun etc... not a single robot ever decided that ""hey, maybe I would enjoy life better if I didn't look like Mr. Peanut?!""

Also, there is ZERO military control over the exclusion zone. Just a bunch of robots that promise not to go over or under the wall however a random kid, a thief and a corporate goon can get in and out.

The near adult female child is under house arrest from a single male foster parent who obviously is only there to use her as a paycheck and nobody seems to think it's weird that an older man wants to foster a 16/17 year old girl... sure that's fine, no ulterior motive there.

The robots in the exclusion zone seem to be able to get electricity somehow and the doctor that's hiding out there seems to have WiFi, food and clothing without any issue.

The robots that were at war with all of humanity don't execute the three humans that wander into their camp. They feed them and develop friendship with the pretty much overnight.

Sorry the actors got stuck with the story. Hopefully the book did a better job.",2.5
"It's not perfect and it's definitely not the book. But it's a fun ride, it's got heart and underneath the surface it has something to say about technology and society. ",4
A fun movie to watch with your family. We really enjoyed it.,4
I don't know why everyone is saying this is a bad movie. I thought it was pretty good. ,5
"Adventurous, humorous, emotional, meaningful, touching. 

It's also a very nice story. Fun movie! It reminds me of a different story, but in it different way made.

Highly recommend this!",5
Don’t listen to the high-standard critics—this movie is a phenomenal masterpiece. They’re more focused on whether a film checks the boxes of the current agenda than on appreciating its actual substance.,5
"I believe all of this movie's hate is politically motivated. It's fun, funny, dramatic, it tugs at heart strings and nostalgia, it looks great!!, the characters seem genuine and smart and very well acted, just overall five stars five stars five stars. I've read reviews with: heartless, soulless, flat, even said this damages all movies coming after it. that's just ridiculous just nonsense this is really a great heartwarming funny beautiful family movie.",5
Fun. That's all I'm gonna say. Just damn right fun! ,5
Hay tantos robots que uno se confunde. Trama muy lenta y previsible ,2.5
"This movie is unwatchable. Conceptually you feel like there’s something there, but the execution is awful. A bad script coupled with messy direction all lead to an excruciating watch. Side note: a slew of 5 star reviews from audience members who haven’t reviewed anything else. When will RT put a stop to this type of score manipulation…",0.5
"Was definitely a good movie. It's tiresome to read the critics reviews. They constantly get it wrong. They keep themselves in high regard and act as though they understand cinema More so then the ""average joe"". But the numbers don't lie. I honestly believe the critics section should be banished from this site. It's a bunch of pompous nitwits who don't represent the real movie going audiences!! Revolution!!",4
"Totally engaging and entertaining family movie. Some original ideas, some borrowed. Who cares?
We went in with no expectations, having only found the movie the night before watching it.
We shared a few laughs as our 10 year old cuddled into me. Isn’t that what any family wants from downtime.
Some of these critics clearly aren’t parents.",4
"Good movie, gets you in the feels, it’s seems like the bad reviews come from people’s political views that don’t align, which is sad, enjoy a movie for what it is",4.5
"Not a bad movie, give it a watch it will either disappoint you a little bit or you actually will like the movie .",3.5
"I really love this movie, have many references who could felt like a another reality, definitely this is not for all audiences, if you like the dystopia and sci-fi movies you will love it.",5
"This is a fun adventure, with an ET/Goonies/Guardians of the Galaxy vibe. If you like the artistic style of the latest Fallout series, you will love the artistic direction of this film. A great watch!",5
Not understanding the hate this movie is receiving. I never write reviews but I’ve got to for this one. Amazing. Loved every minute of it I don’t think there will be a second one but I would certainly watch it. Millie and Pratt were a great team on this one. I was laughing I was intrigued. L-l-l-lovedddd it sorry for anyone that hated it. ,5
"I just bought a car. A used 2019 Toyota Camry. This movie reminds me of it. I bought it to fit my life and mean something to my work, family, and future. Nothing special; nothing a car magazine would gush over, turn heads, or be at your local car show. But my kids love it, my wife is thankful for something reliable, and I am happy I get to work every day to make something of life. The critics work for the magazine and know when they see fine engineering, but they clearly are disconnected from real life. This movie tells a classic story, sure, and dystopian themes are all over the road. But the story of friendship, family, love, and sacrifice just received another worthy skin in this movie, and I loved it.",5
"I must say that I didn't expect much from this movie but was positively surprised. When I've decided to check it on, I did not expect much from it but hoped to at least have some fun watching it. I do not regret watching it. I've really enjoyed the time I've spend with this movie. Maybe it is not a Hollywood blockbuster or a cinematic art and probably won't get an Oscar either, but it's a very well done original idea movie and I like original ideas much more then all those reboots and remakes that movie studios are constantly pushing just for a cheap cash grabs. This was a good original movie and it was fun.",3.5
"I watched this because it seems the critics hate it and my entire life i never liked or cared about what those critics thought hahaha, but it turns out to be a really fun movie!! The cgi is soo stunning! my eyes were truly blessed, the comedy is pretty funny, and I absolutely love the storyline. It’s genuinely an entertaining movie, perfect for a good time and it’s family friendly. But seriously, i feel like this is deserves to be on the big screen, not just on Netflix. ",5
read the book this is based on. just a boring and bland movie. misses the atmosphere and point of the book. chris pratt just being chris pratt in this movie. only good thing about this movie is its visuals.,1
"A kiddified version of Terminator with goofy looking robots, big ideas and big stars but apart from the visuals, none of the elements are used to great effect.  The alternative 90’s style and blend of robots with live action looks good but rather than being humorous, the film focuses on the drama of the story, making some scenes absurd and others just bad.  The film is too long with too many plot holes and apart from the lead, the other characters’ motivations are lacking or contrived. ",2
"I thought it was a very enjoyable watch. It had all the elements of a great family film. Has the emotional of journey that some of my favourite films portray, friendship, loss and victory to name a few. Would happily watch this again when my kids are a little older. ",4
