Review,Score
"Alright, buckle up, buttercups, because 'Electric State' just plugged directly into my happy place! Seriously, this movie was like someone peeked into my brain and said, 'Let's throw every awesome thing in there, crank it to eleven, and then add a healthy dose of pure, unadulterated silliness.'

Did I want epic robot battles? Check. Did I want a post-apocalyptic wasteland that was somehow both gritty and gorgeous? Double check. Did I want a main character who could kick butt and crack a joke in the same breath? You betcha!
This movie knew exactly what it was, and it didn't waste a second trying to pretend it was something else. It embraced the absurdity, threw in some truly laugh-out-loud moments, and never once felt the need to drown us in heavy-handed drama. It was the perfect blend of action, adventure, and 'wait, did that just happen?' hilarity.

'Electric State' isn't trying to win an Oscar for profound philosophical insights. It's trying to give you a wild, fun ride, and it succeeds spectacularly. If you're looking for a movie that doesn't take itself too seriously and just delivers pure, unadulterated entertainment, then plug into 'Electric State.' You won't regret it!
",5
Está entretenida la película los robots 🤖 la actuación de Chris Pratt es buena ,3.5
After reading all the critics reviews of this movie you’d think it was horrible. I watched it and enjoyed the ride. It was a fun movie. We’re in a world where a bad review gets more attention than a good one. ,5
"Great fun if a little predictable. Lots of action, great robots, and I liked the transfer of self into robot avatars. Some harsh criticisms have missed the point as critics often do, taking themselves far too seriously. Family film, easy to watch in these days of pseudo intellectuals who have lost their inner child and imagination. ",4
Mich hat der Film gut unterhalten und ja ich bin jemand der die Buchvorlage nicht kennt. Warum der Film allerdings so teuer sein soll verstehe ich nicht ganz.,4
"Nothing more than CGI slop, I would only recommend it if you’re doing something else and just want something to play in the background.",2
"The attempt to Forster warm fussy feeling on the USA in the early mid ninety failed. If your going to use the big guns from flims and TV from the period. USE them for more than background . I ended up plays name the..... A few times. The reason why I think it is worth watching is the central story of Michelle and her brother. Something I have never seen in this type of film from then was the damsel, or the male equivalent ending there story in that fashion 
",3.5
"Should have titled this movie Rip Off Player One. Between stealing storylines between that, Surrogates, Spock's Brain, and The Phantom Menace, it feels like I've seen this movie 5 times already. Not much original material here. Pratt is always reliable in his usual unlikely, unconventional hero role (it's about as much range as he has) and the visuals are pretty good. Strip out the Sci-fi and the plot is basically a rerun of Family Ties. You gotta love Harrelson in any role he plays. He always commits to the part. Brown is a bad actress  in everything she does, but she has a pretty face, so whatever. ",2.5
"It's boring. Gave up after 20 mins. Like so many Netflix USA shows this year it's all style and no substance. Maybe you should spend next years production budget in Europe and Asia as they seem too make the best shows.... Adolescent, toxic town the leopard. Most of your viewers are now outside the US...maybe consider this.",1
"The aesthetic was nice, the production was good, the acting was actually pretty decent.
All of this is let down by the horrible plot and non-existient character development. You can really feel it was a shallow YA novel that was adapted into a very ""paint-by-numbers"" adaptation with zero tension or impact. It's hard to enjoy the movie when an increasingly larger part of my brain was constantly screaming how stupid everything was, from the premise to the world to the battle scenes to the characters.",1.5
A blast from start to finish. This is bubblegum silliness at its best. There is depth to the story and quirkiness to the characters and fantastic special effects. I don’t know what people who are complaining are looking for. This does what it sets out to do and does it well.,5
"What was there not to like? I went in with low expectations because of the ""professional"" opinions. It was different. Great visuals. It was funny. If they had killed my favorite character (who was not one of the main characters) maybe I would be writing a different review but I don't think so. Some of the reviews I have read feel like they were written by people who watched a different movie than I did. ",5
"I found this film a satisfying and enjoyable watch.  The story was pretty simple but still enough to hold my attention.  I enjoy action films with a bit of levity and this delivers a few nice lighthearted moments.  The acting was good and I would say people should give this a go an ignore the negative critics ratings.  You can always quit partway through if it doesn't appeal, but I think you might be surprised.",4
"Just a fun watch for a Saturday night. It's an interesting premise with a bunch of funny subtle references, lots of comedy and action, and good acting. I never listen to the critics, just check out the Academy awards for the past 10 years.",4.5
It was fun and interesting. Fall Out vibes with a 90's twist. Funny and a decent message.,5
"The author of ""The Electric State"" Simon Stalenhag gave his approval for the film as did the audience as you can see. I specifically love the performances of the dynamic duo Millie Bobby Brown & Chris Pratt, I feel theses two really shined in this film together, I would love to see this duo in another film. ",5
"Well, I must have watched a different movie than the rest of these reviewers, but then I wasn't expecting more than to be entertained for a couple of hours with some mindless meaningless fun.... And that's what I got. So if you're expecting Tolstoy or Shakespeare then you will be sadly disappointed. This is more like top gun. It's popcorn for the soul.",4.5
"Entretenida con mas pretensiones que lo que finalmente consigue, la historia esta bien pero no consigue enganchar.",3.5
Fun movie for a time where life can be overwhelming!,4.5
"This movie is so chalk full of clichés that it could be best utilized as a drinking game and far less as an actual movie to sit and watch. The script is surprisingly bad. That said, the visuals are very good, but that alone can only carry your interest so long while so many other elements seemed designed to annoy. ",1
I have no idea why the critics canned this.  It had a strange 2nd act when we meet the doctor with glasses but the rest was funny and engaging.,5
"Soulless, actorless, plotless, storyless, targetless, innovationless, characterless, pathosless. GPT made.",0.5
I don’t understand all the hate either. Is it a classic? No. Is it predictable? Yes. Is it enjoyable? Definitely! Is it a waste of time? Not at all. Should you watch it? Yes. ,5
"Another Robopoclypse Epic...This made-for-tv Netflix movie based on an old graphic novel...It's ambitious, and not as bad as everyone says it is ...But it's not good either...The problem really here is with the script.  This stuff is too predictable; too passe. And way too CUTESY...And a couple cool sequences here and there don't save it.  (For a much better take on this subject try last year's Creator; that was brilliant!)",2
"Fun movie, mixed 90s references with some post apocalyptic fun. Made pretty well. Not sure why movie critics have a job anymore, they are mostly out of touch with the fans.",5
"I could barely watch up until the middle, but then just gave up. It's so extremely boring and so disappointingly empty, despite basing off the great original work of Simon Stålenhag.",0.5
" Visually, it was very entertaining. 
The Storyline felt predictable, but special moments sprinkled throughout pulled it forward.
I found it difficult to emotionally connect with the ribots' plight, so I watched solely for entertainment...and it delivered.",4
"Would have been a much better watch had they not cast Chris Pratt. Absolute movie killer, takes you right out of it. ",1.5
"Ok so there aren't Oscars happening here (do you really want to go to the cinema always and feel like your heart is broken?) but omg what a popcorn chomping, coke guzzling throwback to the 80's/90's this movie is!! It's got a good story, it keeps you entertained and it is FUN! ",5
"made an account just to say how dogshit this adaptation was. the source material had so much great sceneries and robot designs, then the russo brothers turned it into a bland netflix slop",0.5
"The Electric State"" is a visually stunning, emotionally gripping film that delivers exactly what it sets out to—a fun, immersive, and nostalgic journey through a uniquely crafted world. I watched it last night, and it was everything a great movie should be: entertaining, heartfelt, and visually mesmerizing. If you grew up in the '90s, the soundtrack alone is enough to hit you with waves of nostalgia, pulling you deeper into the film’s atmosphere.

Critics, once again, have completely missed the point. Instead of appreciating the film’s artistry, emotional depth, and world-building, they’ve nitpicked over superficial details, as if every movie has to fit into some rigid, formulaic structure to be considered 'good.' Their inability to engage with films outside of their usual criteria only exposes how disconnected they are from actual audiences.

Ignore the critics. This is a film worth experiencing for yourself. It’s the kind of movie that reminds you why you fell in love with cinema in the first place.",5
"The producers should be commended for trying to give us something new rather than another remake, sequel, prequel, or origin story of a tired intellectual property that ran its course 3 or 4 films ago. I have been a fan of Simon Stålenhag's artwork for several years now and thought the film was able to bring out his artistic vision. There are certainly some plot holes, but it is enjoyable as long as you allow for some suspension of disbelief.",4
"I haven’t read the graphic novel and sometimes it helps to be unprepared, as you’re less likely to have narrow expectations. I had read the terrible critic reviews and was pleasantly surprised. The movie is imaginative and magical. It really looks amazing. The story is wonderful and I felt immersed in this parallel universe. It is also funny and a good, family movie. I thought the cast was great! Millie really added to the nostalgic energy to what felt like could be a classic movie. I do wonder if the directors rushed certain elements which meant it just fell short of accomplishing it. I do hope there will be a sequel. ",4
"I just finished, and I personally loved it like a lott. I would give it a solid 9.5/10🫶🏼 I cried, laughed, sang, danced, and got angry at some of the characters, and it was amazing❤️‍🩹❤️‍🩹 I don't understand why there is so much hate against this movie because it was amazing✨️",5
"It was an pretty good movie, CGI was great and acting was done pretty well, but it was a played out plot that you aren't going to remember anything about in 2 weeks",4
"This is an awesome movie that hits all the emotions: humor, sadness, anger, and empathy. 
The subtle allusions to what’s actually happening in the world are thought provoking. ",5
I am not sure why this movie has beat up by the critics. It has a solid plot and great effects. The cast is fantastic. I truly enjoyed the movie. I wonder sometimes do the critics watch the same movies I do?,4.5
This was probably the worst movie I have ever seen in my life. The fact that major movie stars were attached to this is astounding to me. Is distended and broken. Get a screenwriter and director who who's what the hell they're doing. Wow....just so horrible. ,0.5
"I honestly dont know why people say they dont like it, and make so big fuss about the budget... If you can do it for cheaper and better, please do.... 
I must say, I enjoyed the movie alot. I loved the robots, the creativity that was used, and the storyline. It was something different  that I liked, as it has been a while since a film has captivated me. Lately most films are all predictable and in the same line and boring. I did get all the humor and emotions and will definitely watch it again. Cudos to all involved making this film and the great actors!!! ",5
"Chriss and G are the only ones tried to save the movie......the girls acting is dumb and for some reason,the russo brothers saw it is good........very cringe,very not into character, dialogues doesn't feel deep with the characters,no deep connections or anything............she completely ruined the movie,every scene she's in,its horrible (and she's in the whole movie) ,the first 30mins are enough for people to walk out/quit watching the entire movie ",1
I loved this movie as a fan of robots i was so exited to watch it. loved the story a girl trying to save her brother from a big company i say this movie was 9/10 i would have liked to see more robots and more big ones and a bigger fight.,5
"I don’t understand why this film was so criticized. I found it to be a great movie, with a valuable message about connection in an increasingly individualistic and digitally immersed world. The reviews are positive, the actors’ performances are excellent, the cinematography is beautiful, and the film’s pacing is very well executed. For me, it’s a 10/10!",5
"Kids pooed themselves sadly, abysmal masterclass on how to throw away 320 million supposed dollars",0.5
Loved it! Gave me the fall out vibes. ,5
"What is going on with the critics? Really? Just because they decide to hate something they lose the good judgment, the story of the movie is interesting and the construction of the characters is well made, it’s not perfect but it’s not that bad, the visual effects are very convincing, give it a try! This movie won’t disappoint",4.5
Well this was terrible i wouldn't blame Russo brothers they are great this is just a very odd franchise to adaptation to live action ,0.5
This movie is dreadful. An outstanding cast except for Millie Bobby Brown. She is awful. Chris Pratt is his usual funny self. Everyone else tried but geez nothing can salvage this mess.,0.5
"I wasn't expecting much from it, but with it being a Russo Brothers film, and having an awesome cast, I figured I'd give it a chance.

It's nothing amazing, but it's actually a fun and entertaining movie! The story actually gets you a bit invested, and it kind of reminded me of a mix of Iron Giant and Ready Player One. CGI is really good, Chris Pratt and Millie Bobby Brown are great, and the supporting cast are awesome too. I especially loved Herman, who's voiced by Anthony Mackie, which i didn't realize until I saw the credits (obviously a VERY MCU cast, but great picks, of course).

Overall, worth a watch if you have some time and want to watch something on Netflix.",3.5
"I enjoyed the story and it was different from most live action movies currently. It had some good humor and decent battle scenes loaded with plenty of star power. For 2 hrs let go of taking yourself so serious and just get lost in a story about family, loss, humanity and good vs evil. Enjoy 😉 and don't pay attention to the ""critics"" if it we're left to them there'd be nothing to watch or it would just be repetitive material. The creative swings, even if misses would cease to exist.",4
"Loved the graphic novel, but this is a terrible adaptation with two awful ""actors."" $320 million wasted. ",0.5
Nie powiem że film jest jakiś super ekscytujący ale historia jest w miarę wciągająca i choć wiadomo praktycznie od początku co będzie dalej oraz jak się zakończy to jednak przyjemnie jest ją oglądać,4
"Not sure what the critics have been smoking, but this was a great sci-fi action movie. It also looks amazing. ",5
สนุกครับชอบถูกใจเลิฟ,5
"I Really enjoyed this movie! Great story that I have never see before. So many layers that it keeps you involved it the story that is being told. Top notch special effects. Well done to all that were involved in making this movie I would watch this again and I usually Never watch things twice.
Great work!!
It goes to show you the so called Top Critics Should Not be in the business of reviewing movies, Most of them don't know what they are talking about.",5
"T.E.S. is not really that good of a movie, but it is not as bad as some of the reviews suggest. Let's just say that the two hours it takes to watch the movie are not a waste of time, but they'll be two hours that you don't really feel any need to remember.",2.5
Critics are useless. Never follow their opinions.  ,5
My husband and I watched the movie last night. Despite the critics we thought it was pretty good. I have no complaints at all. It kept us entertained. ,5
I enjoyed this movie. The special effects are amazing. The robots look real. ,4.5
"Fun and absorbing throughout but touchy towards the end, but then the last scene suggests there might be a sequel. Hurrah!",3.5
That there is two hours I will never get back!!! (And this seems to be a bit of a backslide for Chris Pratt),2
"A movie whose greatest achievement is how effectively its creators eradicated the soul of the original work upon which it's based. The visual effects are pretty good too.

I don't know if it's too much botox or acting ability, but, Millie Bobby Brown does an incredible job of hiding the fact that emotions exist, with her entire range expressed through the volume of her voice.

Chris Pratt is, again, Chris Pratt. One time he's called upon to display something other than ""wise-cracking rogue with a heart of gold"" is flatter than an empty can stood on by an 80 feet tall robot.

Much the same goes for the rest of the humans, and I can only imagine that they were instructed to ""Play it exactly how you did in the thing that you're best known for.""

The original work (of the same title), is a subtle, beautiful, and beautifully haunting, thought provoking, mysterious, piece of art (well several pieces of art in fact). Like the best sci-fi it invites the reader to ask questions about the world in its pages and, ultimately, our own.

The only question Netflix's 'The Electric State' gets the viewer to ask is, ""How did they manage to miss the mark so widely?""

",1
"I was going to avoid this movie because of the terrible critical reviews. I’m glad I gave it a shot. The movie was very visual, and had some pretty impressive effects in it. The story was solid, and had funny and touching moments. The soundtrack was awesome and heavy on 90’s nostalgia. Altogether I would say the movie was really good and didn’t deserve a lot of the negative reviews it got. ",4
"Slow, formulaic, cliched, disjointed, and barely watchable. Chris Pratt appears to blow his lines several times, or delivers them poorly, it's hard to tell which. The directing is basic. The acting is subpar. Honestly, it's just not a very good movie.",2
"Me and my family watched the trailer and thought this was going to be a good movie, and we were so wrong. Everything about this movies is absolutely dog shart. I wish I could give this zero reviews. My family agreed that the writes of this movies were has high as a rocket. ",1
"Well shock, the paid critics are wrong again. This is a really good movie.!particularly loved the design of the bots and the world in general.
Chris and Millie are of course great and charming and work well together.
I’m sorry but if you can’t enjoy this movie get a different job. ",4.5
"Perfect movie to watch while cooking or scrolling through social media. Not bad, but there is something missing. Besides, such a big production shouldn’t have tired a theatrical release? ",3
"Slow pace, puerile dialogue but a nice visual style.",1
"The Electric State is a visually stunning film that delivers an immersive and creative experience. The design of the robots is nothing short of amazing, evoking a strong Fallout-like aesthetic that adds depth to the worldbuilding. The artistry and attention to detail in these visuals make the movie stand out, offering a post-apocalyptic feel that is both haunting and beautiful.

While the storyline has a few weaker points, the overall experience remains highly enjoyable. The film has strong rewatchability, with layers of detail that make each viewing rewarding. The Russo brothers did a great job bringing this unique vision to life, and I sincerely hope we see more films like this in the future—there simply aren’t enough of them.

If you're a fan of rich, atmospheric sci-fi with a touch of nostalgia, The Electric State is definitely worth watching.",5
Critics definitely  missed the mark on this one.  I haven't been able to disconnect and enjoy a movie like this in a while.  Yes the plot is pretty basic but connecting with the characters (Both human and robot) was very easy.  I really enjoyed the comedy and action this movie brings.   The critics just seem to want to hear the own voices rather than just sit down and enjoy a movie for what it is. ,4.5
"I don't get the negative reviews, especially the cridicts. Which isn't surprising since they hate about every movie. ",5
I find it sad that people who like this movie might not like the book.,0.5
"'The Electric State' is an incredibly formulaic sci-fi blockbuster that relies on spectacle rather than substance, delivering a pretty but hollow experience. ",2.5
"One of the film’s biggest weaknesses, however, is its antagonist. While the overarching conflict adds stakes to Michelle’s journey, the villain lacks a strong presence. Giancarlo Esposito, who plays a secondary antagonist, brings his usual gravitas to the role and is far more convincing than the film’s primary villain, making one wish he had more screen time or been given a more central role.

Chris Pratt delivers a surprisingly heartfelt performance, and his character’s bond with Herm is the heart of the movie. Their interactions add weight to the story and help ground the film in an emotional reality that keeps audiences engaged.

Woody Norman, in a supporting role, impressively steals scenes, at times overshadowing Millie Bobby Brown’s protagonist. While Brown gives a solid performance, Norman’s nuanced acting and screen presence elevate his character beyond expectations.

Despite some missteps, The Electric State is carried by strong performances and a well-crafted world. The film’s emotional core and striking visuals make it worth watching, even if it falters in villain execution and character balance.",3.5
"For once I can agree with the critics, skip this silly movie if you are older than 8. ",0.5
"My mom and I watched the movie and loved it!!! It has emotions, comedy and lots of action",5
"It was a surprising and real mix of genre, storytelling and visual impact. Reminiscent of the films from the 80s its graphic style is aimed at young people with adult overtones. I can understand why some people feel let down as it’s a bit of a ramble and some of the editing is quite jarring, but it’s still (somehow) completely believable. The actors are all fab, hold the story together well and, again, somehow you don’t lose track of what is happening. The cast of robots and ‘robot world’ are fantastic, unusual and well conceived. A sweet, nostalgic humorous with a large tasty twist of weird randomness. A good watch that perhaps needed a bit more consistency as sometimes it feels like three different films running at once, but super enjoyable nonetheless. 
",3.5
"Honestly, the plot for the first hour is a bit slow. Then, the character development is not explained enough and the ending is also not impressive. For the actors Millie Bobby Brown and Chris Pratt I admit they are really cool, but the rest are still lacking in acting, but this movie is still enjoyable to watch.",3.5
another demonstration that critics and people are very different. this film is fun and exciting and transports us to a dystopian world that allows us to unplug for 2 hours. transmitting the message that we should be more human,5
"Really good story, great visual, a little humour and moral
Perfect👌",4.5
This movie was actually really fun! I don’t understand why they made it PG-13 but it was great! I loved the choices for the actors. I don’t know why people are rating this poorly. It was a pleasant surprise that I enjoyed watching with my family.,4
Worst editing I’ve ever seen. Why cut away from your main star in mid dialogue every time they talk in the first 10 min of movie. So many expo dumps that dont even amount to making the world make sense. ,0.5
The negative reviews are crazy. This setting is amazing. And the acting is an all-star line up. Makes me want to play the RPG,5
